{
  "$schema": "http://json-schema.org/draft-07/schema#",
  "title": "Map 3 Battle 01 turn finalization static fixture",
  "$defs": {
    "hash": {"type": "string", "pattern": "^[A-F0-9]{64}$"},
    "provenance": {"type": "object", "additionalProperties": false, "required": ["repository", "commit"], "properties": {"repository": {"type": "string"}, "commit": {"type": "string", "pattern": "^[a-f0-9]{40}$"}}},
    "sourceIdentity": {"type": "object", "additionalProperties": false, "required": ["path", "sha256"], "properties": {"path": {"enum": ["code/gameflow/battle/battlefunctions/executeindividualturn.asm", "code/gameflow/battle/battlescenes/initializebattlescene.asm", "code/gameflow/battle/battlescenes/battlesceneengine_0.asm", "code/gameflow/battle/cutscenes/afterenemyleaderdeathpositions.asm", "code/gameflow/battle/battlefunctions/loadBattle.asm", "code/gameflow/battle/battleloop_1.asm", "code/gameflow/battle/cutscenes/battleendcutscenesstart.asm", "code/gameflow/battle/battleloop/processkilledcombatants.asm", "code/gameflow/battle/battleloop/countremainingcombatants.asm", "code/gameflow/battle/battleloop/processafterturneffects.asm", "code/gameflow/battle/battleloop_2.asm"]}, "sha256": {"$ref": "#/$defs/hash"}}},
    "anchor": {"type": "object", "additionalProperties": false, "required": ["id", "address", "width", "sha256"], "properties": {"id": {"type": "string", "pattern": "^turnFinalizationSpine\\."}, "address": {"type": "integer", "minimum": 0}, "width": {"type": "integer", "minimum": 1}, "endAddressExclusive": {"type": "integer", "minimum": 1}, "sha256": {"$ref": "#/$defs/hash"}}},
    "projection": {"type": "object", "additionalProperties": false, "required": ["fixtureId", "fixtureSha256", "semanticSha256", "sha256"], "properties": {"fixtureId": {"type": "string"}, "fixtureSha256": {"$ref": "#/$defs/hash"}, "semanticSha256": {"$ref": "#/$defs/hash"}, "sha256": {"$ref": "#/$defs/hash"}}},
    "fixture": {
      "type": "object",
      "additionalProperties": false,
      "required": ["schemaVersion", "id", "upstream", "romSha256", "system", "summary", "retainedR3c", "retainedOwners", "sourceContext", "turnFinalizationSpine", "unknowns"],
      "properties": {
        "schemaVersion": {"const": 1},
        "id": {"const": "sf2-map3-battle01-turn-finalization-static-v1"},
        "upstream": {"$ref": "#/$defs/provenance"},
        "romSha256": {"$ref": "#/$defs/hash"},
        "system": {"const": "sf2-map3-battle01-turn-finalization-static-v1"},
        "summary": {"type": "object", "additionalProperties": false, "required": ["sourceFiles", "h1RomAnchors", "indexObjects", "indexBindings", "unknowns"], "properties": {"sourceFiles": {"const": 11}, "h1RomAnchors": {"const": 34}, "indexObjects": {"const": 11}, "indexBindings": {"const": 28}, "unknowns": {"const": 40}}},
        "retainedR3c": {"type": "object", "additionalProperties": false, "required": ["fixtureId", "fixtureSha256", "actionCompletionSpineSha256", "sha256"], "properties": {"fixtureId": {"const": "sf2-map3-battle01-action-completion-static-v1"}, "fixtureSha256": {"$ref": "#/$defs/hash"}, "actionCompletionSpineSha256": {"$ref": "#/$defs/hash"}, "sha256": {"$ref": "#/$defs/hash"}}},
        "retainedOwners": {"type": "object", "additionalProperties": false, "required": ["battleFunctions", "battleSceneEngine", "battleCutscenes", "battleLoop", "battleControl", "afterTurnStatusLifecycle"], "properties": {"battleFunctions": {"allOf": [{"$ref": "#/$defs/projection"}, {"properties": {"fixtureId": {"const": "sf2-battle-functions-static-v1"}}}]}, "battleSceneEngine": {"allOf": [{"$ref": "#/$defs/projection"}, {"properties": {"fixtureId": {"const": "sf2-battle-scene-engine-static-v1"}}}]}, "battleCutscenes": {"allOf": [{"$ref": "#/$defs/projection"}, {"properties": {"fixtureId": {"const": "sf2-battle-cutscenes-static-v1"}}}]}, "battleLoop": {"allOf": [{"$ref": "#/$defs/projection"}, {"properties": {"fixtureId": {"const": "sf2-battle-loop-static-v1"}}}]}, "battleControl": {"allOf": [{"$ref": "#/$defs/projection"}, {"properties": {"fixtureId": {"const": "sf2-battle-control-static-v1"}}}]}, "afterTurnStatusLifecycle": {"allOf": [{"$ref": "#/$defs/projection"}, {"properties": {"fixtureId": {"const": "sf2-after-turn-status-lifecycle-v1"}}}]}}},
        "sourceContext": {"type": "object", "additionalProperties": false, "required": ["sourceIdentities", "h1RomAnchors"], "properties": {"sourceIdentities": {"type": "array", "minItems": 11, "maxItems": 11, "items": {"$ref": "#/$defs/sourceIdentity"}}, "h1RomAnchors": {"type": "array", "minItems": 34, "maxItems": 34, "items": {"$ref": "#/$defs/anchor"}}}},
        "turnFinalizationSpine": {
          "type": "object",
          "additionalProperties": false,
          "required": ["functionAddresses", "replayContinuation", "outerLoop", "outcomeBoundaries", "ownerRecordIds"],
          "properties": {
            "functionAddresses": {"type": "object", "additionalProperties": false, "required": ["ExecuteIndividualTurn", "InitializeBattlescene", "ExecuteBattlesceneScript", "EndBattlescene", "ApplyPositionsAfterEnemyLeaderDies", "LoadBattle", "BattleLoop", "ExecuteBattleCutscene_Defeated", "ProcessKilledCombatants", "CountRemainingCombatants", "ProcessAfterTurnEffects", "BattleLoop_Victory", "BattleLoop_Defeat"], "properties": {"ExecuteIndividualTurn": {"const": 147120}, "InitializeBattlescene": {"const": 98322}, "ExecuteBattlesceneScript": {"const": 99224}, "EndBattlescene": {"const": 102986}, "ApplyPositionsAfterEnemyLeaderDies": {"const": 294302}, "LoadBattle": {"const": 153104}, "BattleLoop": {"const": 146052}, "ExecuteBattleCutscene_Defeated": {"const": 293778}, "ProcessKilledCombatants": {"const": 148760}, "CountRemainingCombatants": {"const": 146520}, "ProcessAfterTurnEffects": {"const": 148034}, "BattleLoop_Victory": {"const": 146618}, "BattleLoop_Defeat": {"const": 146756}}},
            "replayContinuation": {"type": "object", "additionalProperties": false, "required": ["resumeAddress", "musicSelectorRange", "actorSelectorRange", "initializeBattlesceneCallAddress", "executeBattlesceneCallAddress", "executeBattlesceneScriptEndAddress", "endBattlesceneCallAddress", "leaderDeathPositionsCallAddress", "loadBattleCallAddress", "reloadRange", "returnAddress", "orderedSteps"], "properties": {"resumeAddress": {"const": 147718}, "musicSelectorRange": {"const": [147722, 147876]}, "actorSelectorRange": {"const": [147876, 147908]}, "initializeBattlesceneCallAddress": {"const": 147912}, "executeBattlesceneCallAddress": {"const": 147924}, "executeBattlesceneScriptEndAddress": {"const": 99306}, "endBattlesceneCallAddress": {"const": 147930}, "leaderDeathPositionsCallAddress": {"const": 147936}, "loadBattleCallAddress": {"const": 147956}, "reloadRange": {"const": [147962, 147982]}, "returnAddress": {"const": 148032}, "orderedSteps": {"const": ["musicSelector", "actorSelector", "InitializeBattlescene", "ExecuteBattlesceneScript", "EndBattlescene", "ApplyPositionsAfterEnemyLeaderDies", "LoadBattle", "return"]}}},
            "outerLoop": {"type": "object", "additionalProperties": false, "required": ["executeTurnCallAddress", "executeTurnResumeAddress", "defeatedCutsceneCallAddress", "processKilledFirstCallAddress", "countFirstCallAddress", "preAfterTurnOutcomeRange", "defeatedCutsceneRange", "processKilledSecondCallAddress", "afterTurnCallAddress", "afterTurnResumeAddress", "countSecondCallAddress", "postAfterTurnOutcomeRange", "nextTurnDispatchAddress", "backedgeAddress", "backedgeTarget"], "properties": {"executeTurnCallAddress": {"const": 146260}, "executeTurnResumeAddress": {"const": 146264}, "defeatedCutsceneCallAddress": {"const": 146282}, "processKilledFirstCallAddress": {"const": 146288}, "countFirstCallAddress": {"const": 146294}, "preAfterTurnOutcomeRange": {"const": [146298, 146310]}, "defeatedCutsceneRange": {"const": [146310, 146324]}, "processKilledSecondCallAddress": {"const": 146328}, "afterTurnCallAddress": {"const": 146324}, "afterTurnResumeAddress": {"const": 146328}, "countSecondCallAddress": {"const": 146334}, "postAfterTurnOutcomeRange": {"const": [146338, 146350]}, "nextTurnDispatchAddress": {"const": 146354}, "backedgeAddress": {"const": 146350}, "backedgeTarget": {"const": 146240}}},
            "outcomeBoundaries": {"type": "object", "additionalProperties": false, "required": ["victoryAddress", "defeatAddress"], "properties": {"victoryAddress": {"const": 146618}, "defeatAddress": {"const": 146756}}},
            "ownerRecordIds": {"const": ["battle.functions.execute-turn", "battle.replay.execute-script", "battle.scene.initialize", "battle.cutscene.leader-death-positions", "battle.functions.load-battle", "battle.control.main-loop", "battle.cutscene.battle-end-start", "battle.loop.process-killed", "battle.loop.count-remaining", "battle.status.after-turn-expiry", "battle.control.outcomes"]}
          }
        },
        "unknowns": {"type": "object", "additionalProperties": false, "required": ["naturalContinuity", "initializedSnapshot", "naturalFirstActor", "actorControlBranch", "playerInputChronology", "aiCommandSelected", "movementPath", "target", "action", "preResolutionArrival", "dispatchBranchReached", "perTargetResult", "statusOutcome", "targetDeath", "expAward", "goldAward", "dropOutcome", "followupOutcome", "postEffectArrival", "afterTurn", "multiRoundPlaythrough", "victory", "playerReady", "primaryTargetLoopCompletion", "doubleAttackReached", "counterAttackReached", "explosionReached", "itemBreakOutcome", "actionConstructionCompletion", "writeBattlesceneReturn", "battleSceneReplay", "executeIndividualTurnReturn", "nextTurnDispatch", "battleSceneMusicBranch", "battleSceneInitialization", "battleSceneTeardown", "battlefieldReload", "defeatedCutscene", "preAfterTurnOutcomeGate", "postAfterTurnOutcomeGate"], "properties": {"naturalContinuity": {"const": "Unknown"}, "initializedSnapshot": {"const": "Unknown"}, "naturalFirstActor": {"const": "Unknown"}, "actorControlBranch": {"const": "Unknown"}, "playerInputChronology": {"const": "Unknown"}, "aiCommandSelected": {"const": "Unknown"}, "movementPath": {"const": "Unknown"}, "target": {"const": "Unknown"}, "action": {"const": "Unknown"}, "preResolutionArrival": {"const": "Unknown"}, "dispatchBranchReached": {"const": "Unknown"}, "perTargetResult": {"const": "Unknown"}, "statusOutcome": {"const": "Unknown"}, "targetDeath": {"const": "Unknown"}, "expAward": {"const": "Unknown"}, "goldAward": {"const": "Unknown"}, "dropOutcome": {"const": "Unknown"}, "followupOutcome": {"const": "Unknown"}, "postEffectArrival": {"const": "Unknown"}, "afterTurn": {"const": "Unknown"}, "multiRoundPlaythrough": {"const": "Unknown"}, "victory": {"const": "Unknown"}, "playerReady": {"const": "Unknown"}, "primaryTargetLoopCompletion": {"const": "Unknown"}, "doubleAttackReached": {"const": "Unknown"}, "counterAttackReached": {"const": "Unknown"}, "explosionReached": {"const": "Unknown"}, "itemBreakOutcome": {"const": "Unknown"}, "actionConstructionCompletion": {"const": "Unknown"}, "writeBattlesceneReturn": {"const": "Unknown"}, "battleSceneReplay": {"const": "Unknown"}, "executeIndividualTurnReturn": {"const": "Unknown"}, "nextTurnDispatch": {"const": "Unknown"}, "battleSceneMusicBranch": {"const": "Unknown"}, "battleSceneInitialization": {"const": "Unknown"}, "battleSceneTeardown": {"const": "Unknown"}, "battlefieldReload": {"const": "Unknown"}, "defeatedCutscene": {"const": "Unknown"}, "preAfterTurnOutcomeGate": {"const": "Unknown"}, "postAfterTurnOutcomeGate": {"const": "Unknown"}}}
      }
    }
  },
  "$ref": "#/$defs/fixture"
}
